restaurant_id,restaurant_name,categories,sql_time,vector_time,sql_top_match,sql_similarity,vector_top_match,vector_similarity
sMjjClYrGEXcTFG66qmg8A,Thai House,"Thai, Restaurants, Noodles, Vegetarian",0.07006216049194336,0.029977798461914062,39 North Taproom & Grill,0.7,Thai Sa-Moot,0.8186239220352324
ySIkWUgh8ZZSfZUL4RGi1Q,Tim's Bakery,"Restaurants, Food, Bakeries",0.048413991928100586,0.016942739486694336,Kalman's Bakery,1.0,Dunkin',0.6105653361328471
4bxby6xcP1iP8oXrdvsW7w,Main Street Pizzeria & Grille,"Seafood, Pizza, Restaurants, Italian",0.04918503761291504,0.01676011085510254,Craft Hall,0.7,Tony Roni's,0.8194486039383985
N_l-7ph7JJ6UchQfZIkUcA,Oishii Sushi House,"Sushi Bars, Restaurants, Asian Fusion, Japanese",0.05150723457336426,0.016633033752441406,Yuno Sushi & Asian Cuisine,0.96,Saki Endless Sushi & Hibachi Eatery,0.8143099546432726
QlI4_BHwxb5UplGwd4vE0w,Fiesta Taqueria,"Mexican, Restaurants",0.04845023155212402,0.017919063568115234,México Lindo,1.0,Burritos Grill Mexican Fresh Cuisine,0.8301694202019166
H9YalVFugskHF38MfJWT_w,@Ramen,"Restaurants, Japanese, Ramen",0.0519251823425293,0.016549110412597656,Ai Ramen,0.96,JH Cafe,0.8144812648659729
5xd-UOui26nPkNLos2PjcA,The Dewey Beach Bar & Grill,"American (Traditional), Breakfast & Brunch, Wine Bars, Bars, Nightlife, Restaurants",0.046365976333618164,0.016427993774414062,Roast Coffeehouse and Wine Bar,0.7,The Mill Restaurant,0.7907856134219257
QJfM8uRNy6KHhj6kIatzmg,Whitebox Eatery,"Food, American (Traditional), Cafes, Coffee & Tea, Salad, American (New), Breakfast & Brunch, Restaurants, Sandwiches",0.045700788497924805,0.016530752182006836,Roast Coffeehouse and Wine Bar,0.7,Odessa Family Restaurant,0.7298766213581945
piUZEndStsWNnRUwOPk8jA,King's Garden,"Chinese, Cantonese, Restaurants, Beer, Wine & Spirits, Food",0.04854393005371094,0.01657867431640625,Craft Hall,0.7,New Dragon Express,0.7533508980242912
dWWOryYimQs3EzmejrVt7w,Boulevard Pizza,"Restaurants, Pizza",0.05203390121459961,0.01688694953918457,Venzo's Pizza,1.0,Pizza Guys,0.7399515289082698
my8iGnzOiOO3__WCuRRlbQ,Bricco Coal Fired Pizza,"Food, Caterers, Italian, Specialty Food, Restaurants, Event Planning & Services, Pizza",0.044207096099853516,0.016638994216918945,Roast Coffeehouse and Wine Bar,0.7,Steve's Pizzeria,0.7021608384395398
q7QB5Ie6-M3HF1qggzm_iQ,O'Grady's Family Restaurant,"American (Traditional), Restaurants",0.04722094535827637,0.016592979431152344,Revivals Restaurant & Banquets,1.0,Big Shirley's,0.5922040233368846
N6VbRekOBjRfru_Ci1AFnQ,Divincenzo's Pizza,"Restaurants, Pizza",0.05531787872314453,0.016885042190551758,Venzo's Pizza,1.0,Pats Select Pizza | Grill,0.7902409434319441
X6tbwAVDNHv7V60nB5wXiQ,The Chocolate Bar,"American (Traditional), American (New), Restaurants, Lounges, Nightlife, Beer, Wine & Spirits, Chocolatiers & Shops, Food, Specialty Food, Desserts, Bars, Fondue",0.07004785537719727,0.016943931579589844,Craft Hall,0.7,Green Iguana Bar & Grill,0.7447934898857301
YtSqYv1Q_pOltsVPSx54SA,Rittenhouse Grill,"Wine Bars, Restaurants, Nightlife, Steakhouses, Seafood, Bars",0.062299251556396484,0.01775979995727539,Craft Hall,0.7,Slate Bleu Restaurant,0.7843516188611049
QTBdaWGptIqkIvh_LfVxnw,Arby's,"Restaurants, Burgers, Sandwiches, Fast Food",0.062352895736694336,0.016862154006958008,Five Guys,1.0,Dairy Queen,0.6047888938893882
zQ4yPiqoyMtoohGpEip7zw,The Growler Guys,"Breweries, Nightlife, Chicken Wings, Pizza, Food, Restaurants, Beer Gardens, Pubs, Bars",0.04034304618835449,0.017126083374023438,Roast Coffeehouse and Wine Bar,0.7,Chase's Hop Shop,0.6739976010917905
UqhjqGvVVYjJu9JsAr5W9A,Pignic Pub & Patio,"Beer, Wine & Spirits, Burgers, Cocktail Bars, Bars, Gastropubs, Nightlife, Breakfast & Brunch, Food, Restaurants, Pubs, Venues & Event Spaces, Barbeque, Event Planning & Services, Sports Bars",0.04578399658203125,0.01842498779296875,Roast Coffeehouse and Wine Bar,0.7,Murphy's Bar & Grill,0.7192909524078274
Q9knOlfU9ppR1HhtK8r7qA,Wawa,"Delis, Restaurants, Coffee & Tea, Food, Breakfast & Brunch, Bagels, Sandwiches",0.03970909118652344,0.01639103889465332,Craft Hall,0.7,Wawa,0.7828689943034404
LUylXHZ6fhzah0-OvMPOng,Smokin' Gecko's BBQ,"Restaurants, Barbeque",0.04527568817138672,0.017543792724609375,Sloppy Hoggs Roed Hus,1.0,Duke's Bbq,0.7703387145520514
yE1raqkLX7OZsjmX3qKIKg,Butcher & Bee,"Middle Eastern, American (New), Restaurants, Mediterranean, Southern",0.039144039154052734,0.016597986221313477,Roast Coffeehouse and Wine Bar,0.7,Cocoa's Restaurant & Lounge,0.718241066565744
_9JumTIHEQgTV9-gGe_TWg,Sligo,"Restaurants, Pubs, Bars, Irish, Nightlife",0.03968691825866699,0.016379117965698242,Finnigan's Wake,0.96,Firetruck Brewing,0.7884895658322351
CJ3t6dw60CdpflWKe3b78Q,Benihana,"Japanese, Steakhouses, Sushi Bars, Restaurants",0.0425410270690918,0.016300201416015625,Cheeseburger In Paradise,0.7,Benihana,0.7425404462363406
E1gf1YIWOo1BgzMUwJtEZg,Top Tomato Bar & Pizza,"Pizza, Breakfast & Brunch, Nightlife, Sandwiches, Italian, Restaurants, Cheesesteaks, Food Delivery Services, Cocktail Bars, Sports Bars, Food, Bars",0.04078197479248047,0.016464948654174805,Craft Hall,0.7,Tony & Joe's Pizzeria,0.7899816366981062
kq5Ghhh14r-eCxlVmlyd8w,The Coventry Deli,"Restaurants, Delis, Salad, Sandwiches",0.03929924964904785,0.016419649124145508,Frankie's Deli,0.96,Lee's Hoagie House,0.7726527723487887
iCUHI16oF6XpG9av4zA-FA,Anchor High Grill,"American (New), Restaurants",0.038691043853759766,0.016414880752563477,Barbacoa,1.0,Seffner Tiki Hut,0.7442020690742268
ONlmxkw9jwZytY2IDZIINQ,Sweet Sensation Donuts,"Restaurants, Food, Patisserie/Cake Shop, Hot Dogs, Donuts",0.04275989532470703,0.01651787757873535,39 North Taproom & Grill,0.7,Duck Donuts,0.8065770143350738
r2cjbHG_WGWUkaPCbLpo-A,Philly Fusion & Grill Chicken Bowl,"Restaurants, American (Traditional)",0.041539907455444336,0.016583919525146484,Café at The Square,1.0,Tuttini,0.7329680245652421
3UK4mtRYfn0efzFKbDEtCA,Hungry Howie's Pizza & Subs,"Pizza, Restaurants, Italian, Chicken Wings, Sandwiches",0.048002004623413086,0.01713109016418457,Hungry Howie's Pizza & Subs,0.8799999999999999,Domino's Pizza,0.8199502611100985
oNDzbB73ipPBNbICtJquHw,Sahm's Place,"Restaurants, American (Traditional)",0.04795217514038086,0.017763137817382812,Café at The Square,1.0,Twin Peaks Maplewood,0.6570077555761786
vfQtETvyZOi5iZZHMq0dKQ,Luca Pizza,"Pizza, Restaurants",0.04883694648742676,0.016692161560058594,Versato's Pizza,1.0,Some Guys Pizza Pasta Grill,0.7813359443355121
aQ5DSmc2f2XPB5Iug8CBhg,Five Guys,"Restaurants, Burgers, Sandwiches, Fast Food",0.047165870666503906,0.016594886779785156,Arby's,1.0,AMOT Eatery- A Matter of Taste,0.6915203288459301
YlVb_cW3e68Q0ifNYVKuiw,Mango,"Tapas Bars, Peruvian, Restaurants, Latin American",0.04930615425109863,0.016590118408203125,Roast Coffeehouse and Wine Bar,0.7,39 West American Bistro,0.7710920385553781
OAkcBAwedonnwT3Wf_DqTw,Parks Place Pub,"Casinos, American (Traditional), Pizza, Arts & Entertainment, Sports Bars, Bars, Nightlife, Restaurants",0.04703998565673828,0.016646146774291992,Roast Coffeehouse and Wine Bar,0.7,Glory Days Grill,0.7509077191353057
A5O2qtmgQ1pZ94VYLezNMw,Dairy Queen,"Sandwiches, Burgers, Restaurants, Ice Cream & Frozen Yogurt, Fast Food, Food",0.05040407180786133,0.0166780948638916,39 North Taproom & Grill,0.7,Creanies Ice Cream,0.5670865178108255
E0KwLVaQ-uKEjJl3j_VAGQ,Firehouse Subs,"Restaurants, Delis, Sandwiches, Fast Food",0.04665708541870117,0.017447233200073242,Firehouse Subs,1.0,Port of Subs,0.6921742283778812
zSIArgI4wjgDJBgYXfNxgA,Penn Station East Coast Subs,"Sandwiches, American (New), Cheesesteaks, Restaurants",0.04327201843261719,0.01646280288696289,Craft Hall,0.7,Penn Station,0.7575624052342333
uYBx50Yl_Jc-UYwFzudBsQ,Chew Doin Fried Chicken & Ramen,"Restaurants, Chicken Shop, Ramen, Japanese",0.05546402931213379,0.016859054565429688,China Dragon Restaurant,0.7,Minato Noodles,0.7133073506698601
DMlBzp6bs_f8WK8xQQvZWQ,Mariachis II Mexican Restaurant,"Mexican, Restaurants, Tex-Mex",0.0434870719909668,0.01650404930114746,Speedy Burritos,1.0,Taqueria Feliz,0.7830893034663592
neWdmzHgbpqSx62jynDd7A,Broussard's,"Seafood, French, Restaurants, Cajun/Creole",0.04706907272338867,0.017331838607788086,Craft Hall,0.7,Orleans Grapevine Wine Bar & Bistro,0.7509572880477019
buhO8vRCaEoNvlxU0AJRpQ,Starbucks,"Food, Coffee & Tea, Restaurants",0.047247886657714844,0.01661992073059082,Starbucks,1.0,Starbucks,0.730029459006669
NxJk32DFY06EbFAvcQJumw,Singha Song Thai,"Restaurants, Thai",0.04587197303771973,0.016536951065063477,Royal Thai Orchid,1.0,HTAW METTA,0.823404315621313
vDqjHeX51JSaaI7zxR9jAA,Captain Sushi & Juicy Seafood,"Cocktail Bars, Soup, Sushi Bars, Korean, Seafood, Nightlife, Restaurants, Bars",0.0486600399017334,0.016664981842041016,Roast Coffeehouse and Wine Bar,0.7,Kampai Sushi Bar,0.6661988695741385
M2S5ELqHjz1B1booBTN1dQ,Subway,"Sandwiches, Restaurants, Fast Food",0.043190956115722656,0.016571760177612305,Subway,1.0,Subway,0.7942157852503837
zJdQwRbI7p0bH_60sfBSYA,Subway,"Sandwiches, Fast Food, Restaurants",0.045452117919921875,0.016726016998291016,Penn Station East Coast Subs,1.0,Subway,0.7235645106641514
tXfeVYKJq-bGPx1sjHOMHA,Village Inn,"Diners, Restaurants, American (Traditional), Breakfast & Brunch",0.042227983474731445,0.016415119171142578,Denny's,0.96,Mamas Kitchen,0.7081780085776064
UjXH7iq8eYauQoGswkxGYw,Wawa,"Food, Restaurants, Convenience Stores, Delis, Coffee & Tea, Sandwiches",0.04757285118103027,0.016508102416992188,Ana's Corner Store,0.84,Wawa Food Markets,0.766338247002062
aVRVBncwdK3GrqLKLFPKAg,Paradise Pizzeria,"Restaurants, Pizza",0.05189776420593262,0.017571210861206055,Little Caesar's,1.0,Big Pie Pizza,0.7072799416566132
Te5RzXrZ20zekpFzyj1d4w,Remy’s Cafe,"Breakfast & Brunch, Restaurants, Waffles, Creperies",0.05157184600830078,0.01707911491394043,39 North Taproom & Grill,0.7,Raptor Canyon Cafe,0.7767833535154722
7LHtG34gI4kVOuCiUgTruQ,Burger King,"Burgers, Restaurants, Hot Dogs, Fast Food",0.04886198043823242,0.01986217498779297,Burger King,1.0,Burger King,0.7686724662780816
Rl7W2JPAUWFo2ZZdVeGAWA,Koffee Korner Cafe,"Restaurants, Food, Coffee & Tea, Sandwiches, Breakfast & Brunch, Cafes",0.08434486389160156,0.01939702033996582,Craft Hall,0.7,Sunrise Eatery,0.7461373370476672
WeU7pN8VmkhxiVD71-pWGA,Royal Cafe,"Cafes, Restaurants",0.05104494094848633,0.0174710750579834,Cafe Patachou,1.0,Hong Kong Express,0.7459452161919609
QGUj9Za0iG_OJz0CqujE_Q,St. Pete Bagel Co.,"Sandwiches, Restaurants, Bagels, Food, Donuts, Coffee & Tea",0.04412198066711426,0.01669597625732422,39 North Taproom & Grill,0.7,NY Bagel Cafe & Deli,0.7772664792160419
Ye3-MAFCUFrJcnnARErOuQ,Pepe's Cuban Cafe,"Restaurants, Cuban",0.04583573341369629,0.01752614974975586,Hemingway’s Cuban Kitchen,1.0,Ybor Grille,0.8126385174278877
paO0ETshl56TNSaEyzm9Cw,Brodo,"Coffee & Tea, Restaurants, Sandwiches, Food, Soup",0.04338788986206055,0.01661396026611328,China Dragon Restaurant,0.7,Fresh,0.6421026418086763
miCXkkSGD4qCPUCIb5DHPw,Taqueria y Carniceria Mi Mexico,"Restaurants, Mexican, Food, Grocery",0.04368114471435547,0.016581058502197266,La Consentida,0.84,California Tortilla,0.7483523934097538
nCZR84HJcR1MTjDrJfHkcg,The Munchy Machine,"Food Trucks, Food, Caterers, Event Planning & Services, Comfort Food, Restaurants",0.04379391670227051,0.016557931900024414,39 North Taproom & Grill,0.7,Jimboys Tacos,0.7323648728027613
aeK0oVwtG3CUC4YfX4uCzA,The Inn at Barley Sheaf Farm,"Restaurants, Bed & Breakfast, Hotels, Event Planning & Services, American (New), Venues & Event Spaces, Hotels & Travel",0.042230844497680664,0.016494035720825195,39 North Taproom & Grill,0.7,Washington Crossing Inn,0.6527753240526541
Ee0DwQtmCxhcwSFvX1Gl6g,Olive Garden Italian Restaurant,"Wine Bars, Italian, Restaurants, Bars, Salad, Soup, Nightlife",0.04759502410888672,0.016565322875976562,China Dragon Restaurant,0.7,Olive Garden Italian Restaurant,0.7978062636237905
c5UaaWzJwleA-23NEsK7uw,Williamsburg Cucina Caffe' e Bottega,"Food Trucks, Restaurants, Italian, Caterers, Event Planning & Services, Food",0.04447507858276367,0.0165560245513916,The Mad Griddle ,0.7,Nova's Pizza & Pasta,0.7741653553892864
AHqYW_taqAvhBkYBElkcTQ,Boom Buns,"Dim Sum, Noodles, Restaurants, Food, Cantonese, Chinese, Asian Fusion",0.04563498497009277,0.016509056091308594,39 North Taproom & Grill,0.7,New Number One Chinese Restaurant,0.7911389954860004
v3cbEy9tUWqeVVHQM5ZZ4A,Harvinskins Seafood Market & Cafe,"Food, Seafood, Specialty Food, Restaurants, Cafes",0.04491901397705078,0.016556978225708008,39 North Taproom & Grill,0.7,Nauti Mermaid Crab House,0.7948388090442173
5Y7cqSgUSfLwn7ulBeO_sA,Bluestone Lane - Philadelphia,"Coffee & Tea, Breakfast & Brunch, Restaurants, Gluten-Free, Cafes, Food",0.04930281639099121,0.016505002975463867,Roast Coffeehouse and Wine Bar,0.7,The Zen Den,0.7279924044622664
aNXw3PkXVt8ANwLyCfcmpg,McDonald's,"Restaurants, Fast Food, Burgers, Food, Coffee & Tea",0.045133113861083984,0.01651930809020996,McDonald's,1.0,Red Robin Gourmet Burgers and Brews,0.7383611926486359
glMJCRj6IglVf62LRzVofQ,Hawthorne Bottle Shoppe,"Delis, Restaurants, Nightlife, Wine Bars, Bars, Beer Bar, Breakfast & Brunch",0.04309892654418945,0.016452789306640625,39 North Taproom & Grill,0.7,Olde Black Horse,0.6995547055667337
OIES_WhdNux3PmvSuPM-8Q,Toki Sushi,"Restaurants, Japanese, Sushi Bars",0.042542219161987305,0.016520977020263672,Daiki Hibachi and Sushi,1.0,Sushi Spice,0.8342817674363279
IutQN-u-d_T4Ra0MMHKeIw,Taco Bell,"Restaurants, Mexican, Fast Food, Breakfast & Brunch, Tacos, Tex-Mex",0.041673898696899414,0.016813039779663086,Taco Bell,0.8799999999999999,Taco Bell,0.7760923709539096
rmhorp2X8K57jqDofhWS7Q,Wayback Burgers,"Fast Food, Restaurants, Burgers, Hot Dogs, American (Traditional)",0.04064369201660156,0.016563892364501953,China Dragon Restaurant,0.7,Burger King,0.6989750711583231
ErJ9NtMXt-WJZV_TVZ08Ag,Green Garden,"Sushi Bars, Chinese, Soup, Seafood, Restaurants",0.043166160583496094,0.01648712158203125,Craft Hall,0.7,Oyishi Buffet,0.8067246059404127
6OmIGXQZPFbbWWlhxbRP8w,El Buen sazón Restaurante guatemalan and Mexican grill,"Food, Spanish, Restaurants, Mexican",0.04171895980834961,0.01651597023010254,39 North Taproom & Grill,0.7,La Fuente Mexican Grill,0.7882532982222379
rKe7iEiqe8TVqvwZLdlhRA,Burger King,"Fast Food, Restaurants, Burgers",0.041383981704711914,0.016460895538330078,McDonald's,1.0,Elevation Burger,0.7614842142001748
BXUqeFDqvTK2uL6sQd5YnQ,Crazy D’s Hot Chicken,Restaurants,0.042305946350097656,0.01648998260498047,Margaritaville Store,1.0,Cheddar's Scratch Kitchen,0.727142588623915
IhrTLL6az3q192ik4P05IQ,The Chef and I,"Tapas/Small Plates, Nightlife, Bars, Food Delivery Services, American (New), Southern, Restaurants, Tapas Bars, Food, Cooking Classes, Arts & Crafts, American (Traditional), Event Planning & Services, Wine Bars, Caterers, Shopping",0.04259204864501953,0.016530990600585938,39 North Taproom & Grill,0.7,Doll's Family Cafe,0.8435722273161019
DdFfDwu5z7f24pp6e_q2XA,Roy Rogers,"Food, Fast Food, Burgers, Restaurants",0.04232001304626465,0.01645207405090332,McDonald's,0.7,Wendy's,0.7201102900768069
LAUvZGqjB6edmeD1RTX6fQ,St Roch Kitchen,"Cafeteria, Sandwiches, Restaurants, Breakfast & Brunch, Local Flavor",0.04215383529663086,0.016482830047607422,Craft Hall,0.7,Loco Lucho's Latino Kitchen,0.7798453569412287
UTm85DD1C_GMNrDzJVT9nA,New King Wok,"Chinese, Restaurants",0.04044222831726074,0.01642584800720215,Chinese Delight,1.0,Wok Express,0.7939200524139387
XhQYUlI68tXpwJQ0QXjJgw,Wheat Garden,"Food, Chinese, Comfort Food, Restaurants, Specialty Food, Ethnic Food, Halal, Noodles, Soup",0.040296077728271484,0.01634502410888672,Roast Coffeehouse and Wine Bar,0.7,Li Chinese Reaturant,0.687601108097975
sfbg2kxnvKpmlIuCUas5TA,Lucky Wok Restaurant,"Restaurants, Chinese",0.03961300849914551,0.016415834426879883,New Golden Buffet,1.0,New China Moon,0.7325332500855348
oVdmgPooxFdR6oZ83ohERw,John's Village Market - Berwyn,"Restaurants, Sandwiches, Cheesesteaks, Delis",0.0418548583984375,0.016458988189697266,Tony & Ruth Steaks,0.96,Penn Station East Coast Subs,0.7359473862679489
jW63U-oCMlVoNZarheItpA,Culver's,"Food, Burgers, Fast Food, Restaurants, American (New), Ice Cream & Frozen Yogurt",0.040190935134887695,0.0164639949798584,Craft Hall,0.7,Culver's,0.8058561451264116
1ddqdY_piKp-abaZ-bGRSA,Crescent City Steak House,"Steakhouses, Restaurants",0.03960013389587402,0.016386032104492188,Lock Stock & Barrel,1.0,Bob's Steak & Chop House,0.7922067529970616
GoX9xsurR2_UNsJTzZVkjQ,Eggroll Queen Cafe,"Restaurants, Vietnamese, Cafes",0.0436100959777832,0.016540050506591797,Roast Coffeehouse and Wine Bar,0.7,Rock N' Rolls Egg Rolls,0.7080015476947391
eK5SVQ2-Bvco1Nrcl-lgxQ,CJ's Bar-B-Skew,"Greek, Restaurants, Barbeque",0.04310798645019531,0.01657700538635254,China Dragon Restaurant,0.7,Smashburger,0.7113267567358416
5PwNgUrPnJ2rUyUGSpSn9g,Round Table Pizza,"Pizza, Restaurants, Buffets",0.04230904579162598,0.017221927642822266,McDonald's,0.7,Pizza Hut,0.8161525859969364
c5TYSwk0GsSHMlMEbFc_KQ,Sentiments Wine and Cheese Dive,"Restaurants, Wine Bars, Nightlife, French, Bars",0.044838905334472656,0.01684880256652832,The Mad Griddle ,0.7,The Chocolate Bar,0.6069596356415448
2uF4mczsF86JI-Bnt7keDA,Atomic Wings & Things,"Restaurants, Pizza",0.042713165283203125,0.01646900177001953,Rosa Pizza,1.0,Pizza Hut,0.7355896303226379
WJxrOEC2WF7iXAtkdk3eqA,Dona Linda,"Mexican, Restaurants",0.04280400276184082,0.01657891273498535,Taqueria Pico De Gallo,1.0,Plaza Azteca - Sicklerville,0.7573415185605695
ckNVsfVzpo9FJPO0Axrw3A,Basil India,"Chinese, Asian Fusion, Indian, Restaurants, Thai",0.040946006774902344,0.016498088836669922,39 North Taproom & Grill,0.7,Iron Hill Brewery & Restaurant,0.7582786473021477
mW6A9DYIIhfnDy1nlEvJfQ,Seno Mexicano,"Event Planning & Services, Mexican, Venues & Event Spaces, Restaurants",0.04351401329040527,0.01643991470336914,China Dragon Restaurant,0.7,Pra_LEES,0.7709361134932281
ffi48yk8tmg6NY9iIKZBBQ,Media Bean Cafe',"Breakfast & Brunch, Sandwiches, Coffee & Tea, Restaurants, Cafes, Desserts, Food",0.045066118240356445,0.01653003692626953,39 North Taproom & Grill,0.7,Coffee & Cream,0.7575750901841249
9-uRQkRkXdPQmnU1o8wc4Q,The Local Omnivore,"Breakfast & Brunch, Food, Sandwiches, Restaurants, Food Trucks",0.04537034034729004,0.016558170318603516,Roast Coffeehouse and Wine Bar,0.7,V-Trap Kitchen and Lounge,0.7445758054771279
4A_1kNLFVYmQ-zfz93huBg,Tequila Mexican Restaurant,"Bars, Event Planning & Services, Restaurants, Caterers, Nightlife, Latin American, Mexican, American (Traditional)",0.04294395446777344,0.016509056091308594,Craft Hall,0.7,Las Maracas,0.7719491720200079
KPmFv_Ou6ddauV_gYauWzg,Taquería La Juquilita,"Mexican, Restaurants",0.045488834381103516,0.01655721664428711,Taqueria El Sol,1.0,Taqueria y Birrieria Aqui es Jalisco,0.8269143207720342
SyfP3r24NyOICnWrAYZgeQ,La Fusion Cafe,"Asian Fusion, Food, Restaurants, Sushi Bars",0.041338205337524414,0.01653313636779785,Roast Coffeehouse and Wine Bar,0.7,Parish Seafood & Diner,0.7169686004789441
XiLBIu6YLaC8awWGfw1vGQ,Pho Binh Vietamese Noodle House,"Vietnamese, Restaurants",0.042968034744262695,0.016535043716430664,Bamboo Bistro,1.0,Pho Anh Sang,0.7503843752926335
DKXeB-JIou5XPI49CzITuQ,China House,"Restaurants, Chinese",0.042177677154541016,0.016534090042114258,Happy Wok,1.0,Super Wok,0.7236396670341492
Ko6WrkU-vUngOIJG_isrzA,Fireside Bar & Grille,"Diners, Pizza, Food, Restaurants, Steakhouses, Desserts, American (Traditional)",0.04201698303222656,0.016596317291259766,Craft Hall,0.7,Uno Pizzeria & Grill,0.7819478744849016
N0gGkw0xLjIwAIG7GlB3ag,Burger King,"Burgers, Fast Food, Restaurants",0.041795969009399414,0.01658177375793457,Wendy's,1.0,Wendy's,0.7873882576157422
WCVFqK84i2H5EClSoow7ZA,Itty-Bitty,"Sandwiches, Burgers, American (Traditional), Restaurants",0.04279899597167969,0.01655101776123047,39 North Taproom & Grill,0.7,Five Guys,0.7818006044089645
Qet2jZnhFNk0pdXhOrkOoA,Super Asian Buffet,"Restaurants, Chinese, Buffets",0.04045224189758301,0.018175125122070312,Sun Buffet,1.0,Iron Sheet Royal Grill,0.7961969375610408
